Product_ID,Product Name,Category,Order Year,Stock,Release Date
1,Gekko Costume Set PJ Masks,COST-M,2021,10,9/24/2019
2,Superman Costume for Kids (Satin),COST-M,2021,10,9/25/2019
3,Transformers Bumblebee Costume for Kids,COST-M,2021,10,9/26/2019
4,"Power Rangers Costume for Kids (Colors: Red, Blue, Yellow)",COST-M,2021,10,9/27/2019
5,Iron Man Costume for Kids with Mask,COST-M,2021,10,9/28/2019
6,Red Cars Costume for Kids,COST-M,2021,10,9/29/2019
7,Batman Costume for Kids (Satin),COST-M,2021,10,9/30/2019
8,Captain America Costume for Kids (Satin),COST-M,2021,10,10/1/2019
9,Muscle Batman Costume for Kids,COST-M,2021,10,10/2/2019
10,Army Military Costume Set for Kids with Cap,COST-M,2021,10,10/3/2019
11,Red and White Dress for Babies (Ages 4-22 months),DRSS,2021,10,10/4/2019
12,Thor Costume for Kids with Mask and Cape,COST-M,2021,10,10/5/2019
13,Muscle Captain America Costume for Kids,COST-M,2021,10,10/6/2019
14,Superman Overall for Babies (Ages 6-24 months),BABY,2021,10,10/7/2019
15,Ninja Turtle Costume for Kids with Mask and Shell,COST-M,2021,10,10/8/2019
16,Minnie Mouse Red Polka Dots Dress Costume for Kids,COST-W,2021,10,10/9/2019
17,Muscle Superman Costume for Kids,COST-M,2021,10,10/10/2019
18,Muscle Iron Man Costume for Kids with Mask,COST-M,2021,10,10/11/2019
19,Darna Costume for Kids,COST-W,2021,10,10/12/2019
20,Pink or Red Gingham Checkered Dress for Girls (Ages 6-11),DRSS,2021,10,10/13/2019
21,Catboy Costume Set PJ Masks,COST-M,2021,10,10/14/2019
22,Cream Baptismal Set for Boy with Shoes and Cap,BABY,2021,10,10/15/2019
23,Superman Jacket for Boys Ages 4-10 (jacket can turn into a bag),COST-M,2021,10,10/16/2019
24,[ Adult ] Batman Costume with Cape,COST-M,2021,10,10/17/2019
25,Captain America Overall for Baby,BABY,2021,10,10/18/2019
26,Santa Girl Costume for Kids,COST-W,2021,10,10/19/2019
27,Spider-man Costume for Kids (Satin),COST-M,2021,10,10/20/2019
28,Spongebob Backpack for Kids,BAG,2021,10,10/21/2019
29,Bat Girl Costume for Kids with Mask and Cape (Cotton),COST-M,2021,10,10/22/2019
30,White Baptismal Set for Girl with Shoes and Cap,BABY,2021,10,10/23/2019
31,Muscle Spider-man Costume for Kids,COST-M,2021,10,10/24/2019
32,5 Digit Combination Lock,LOCK,2021,10,10/25/2019
33,Batman Swimsuit for Kids,COST-M,2021,10,10/26/2019
34,Owlette Costume PJ Masks for Kids,COST-W,2021,10,10/27/2019
35,Iron Man Costume for Kids with Mask (Satin),COST-M,2021,10,10/28/2019
36,Animal Costume Elephant for Kids,COST-M,2021,10,10/29/2019
37,Wonder Woman Costume for Kids with Wrist and Head Band,COST-W,2021,10,10/30/2019
38,Red Cars Costume for Kids (Satin),COST-M,2021,10,10/31/2019
39,"Superhero Masks - Thor, Ironman, Bumblebee",MASK,2021,10,11/1/2019
40,Toy Gun Rifle for Kids with Lights and Sounds,TOY,2021,10,11/2/2019
41,Army Costume for Kids with Cap,COST-M,2021,10,11/3/2019
42,Animal Costume Panda for Kids,COST-M,2021,10,11/4/2019
43,Thor Toy Hammer for Kids,TOY,2021,10,11/5/2019
44,Muscle Hulk Costume for Kids with Mask,COST-M,2021,10,11/6/2019
45,Animal Costume Rooster for Kids,COST-M,2021,10,11/7/2019
46,Animal Costume Spotted Dog for Kids,COST-M,2021,10,11/8/2019
47,"Princess Anna Accessories (Crown, Wand, and Hair)",TOY,2021,10,11/9/2019
48,Snake Animal Costume for Kids,COST-M,2021,10,11/10/2019
49,Wonder Woman Costume for Kids with Mask and Cape,COST-W,2021,10,11/11/2019
50,Animal Costume Giraffe for Kids,COST-M,2021,10,11/12/2019
51,Sofia Crown for Kids Pink or Purple,TOY,2021,10,11/13/2019
52,Captain America Onesie Overall for Baby (Ages 6-24 months),COST-M,2021,10,11/14/2019
53,"Princess Elsa Accessories (Crown, Wand, and Hair)",TOY,2021,10,11/15/2019
54,Squid Game Guard Costume for Kids with Mask and Toy,MASK,2021,10,11/16/2019
55,Animal Costume Tiger for Kids,COST-M,2021,10,11/17/2019
56,Muscle Thor Costume for Kids with Mask and Cape,COST-M,2021,10,11/18/2019
57,Squid Game Masks for Kids,MASK,2021,10,11/19/2019
58,[ Adult ] Superman Costume with Cape,COST-M,2021,10,11/20/2019
59,Squid Game Masks for Adult,COST-M,2021,10,11/21/2019
60,Cars Brief for Boy (3-in-1 or per peice),COST-M,2021,10,11/22/2019
61,Spider-man Onesie Overall for Baby (Ages 6-24 months),COST-M,2021,10,11/23/2019
62,Transformers Bumblebee Costume for Kids with mask,COST-M,2021,10,11/24/2019
63,Captain America Pajamas for Boy (Ages 6 to 12),COST-M,2021,10,11/25/2019
64,Spider-man Costume for Kids (Cotton),COST-M,2021,10,11/26/2019
65,Animal Costume Dragon for Kids,COST-M,2021,10,11/27/2019
66,Animal Costume Zebra for Kids,COST-M,2021,10,11/28/2019
67,Animal Costume Ox for Kids,COST-M,2021,10,11/29/2019
68,Muscle Thor Costume for Kids,COST-M,2021,10,11/30/2019
69,Animal Costume Rabbit for Kids,COST-M,2021,10,12/1/2019
70,Bumblebee Swimsuit Costume for Kids Yellow,COST-M,2021,10,12/2/2019
71,Captain America Shield Toy for Kids PVC Plastic,COST-M,2021,10,12/3/2019
72,Dog Costume for Kids Yellow,COST-M,2021,10,12/4/2019
73,Animal Costume Duck for Kids,COST-M,2021,10,12/5/2019
74,Thor Costume for Kids,COST-M,2021,10,12/6/2019
75,Ben 10 Pajamas for Boys (Ages 4 to 10),COST-M,2021,10,12/7/2019
76,Chinese Dress for Kids (Cheongsam),DRSS,2021,10,12/8/2019
