PO_ID,Product_ID,Stock,Retail Price
162,[ Adult ] Batman Costume with Cape,19,340
163,[ Adult ] Superman Costume with Cape,24,340
164,Animal Costume Bear for Kids,24,180
165,Animal Costume Bee for Kids,29,190
166,Animal Costume Cow for Kids,13,190
167,Animal Costume Dragon for Kids,18,190
168,Animal Costume Duck for Kids,26,190
169,Animal Costume Elephant for Kids,52,190
170,Animal Costume Giraffe for Kids,29,190
171,Animal Costume Ladybug for Kids,16,180
172,Animal Costume Monkey for Kids,12,180
173,Animal Costume Mouse for Kids,19,190
174,Animal Costume Ox for Kids,18,190
175,Animal Costume Panda for Kids,16,190
176,Animal Costume Rabbit for Kids,38,190
177,Animal Costume Rooster for Kids,27,190
178,Animal Costume Spotted Dog for Kids,16,190
179,Animal Costume Tiger for Kids,33,190
180,Animal Costume Zebra for Kids,17,190
181,Army Costume for Kids with Cap,35,270
182,Barnie Onesie Overall for Babies (Ages 6-24 months),11,190
183,Bat Girl Costume for Kids with Mask and Cape (Cotton),17,225
184,Batman Costume for Kids (Satin),40,190
185,Batman Swimsuit for Kids,13,180
186,Ben 10 Pajamas for Boys (Ages 4 to 10),11,210
187,Bumblebee Swimsuit Costume for Kids Yellow,13,160
188,Camoflage Set for Boy or Girl,17,210
189,Captain America Costume for Kids (Cotton),15,270
190,Captain America Costume for Kids (Satin),30,235
191,Captain America Onesie Overall for Baby (Ages 6-24 months),13,190
192,Captain America Pajamas for Boy (Ages 6 to 12),11,190
193,Captain America Shield Toy for Kids PVC Plastic,180,75
194,Cars Brief for Boy (3-in-1 or per peice),16,60
195,Cars Swimsuit for Kids (Ages 1-6),11,70
196,Catboy Costume Set PJ Masks,26,205
197,Chinese Dress for Kids (Cheongsam),17,180
198,Cream Baptismal Set for Boy with Shoes and Cap,11,175
199,Darna Costume for Kids,220,140
200,Dog Costume for Kids Yellow,12,180
201,Fairy Costume for Kids with Detachable Wings,12,190
202,Fruits and Veggie Costume for Kids,19,225
203,Gekko Costume Set PJ Masks,17,120
204,Hello Kitty Pajamas for Girls (Ages 1 to 5),11,180
205,Hello Kitty Underwear for Girl (3-in-1 or per piece),11,150
206,Hulk Costume for Kids with Mask (Satin),23,75
207,Iron Man Costume for Kids with Mask (Satin),535,180
208,Mermaid Costume for Kids Green,11,190
209,Mermaid Costume for Kids Pink with Shawl and Tail,11,275
210,Micky Mouse Onesie Overall for Baby (Ages 6-24 months),12,275
211,Minnie Mouse Red Polka Dots Dress Costume for Kids,54,190
212,Minnie Mouse Tutu Dress,11,190
213,Muscle Batman Costume for Kids,37,360
214,Muscle Captain America Costume for Kids,83,290
215,Muscle Hulk Costume for Kids with Mask,57,290
216,Muscle Iron Man Costume for Kids with Mask,298,290
217,Muscle Spider-man Costume for Kids,28,290
218,Muscle Superman Costume for Kids,93,290
219,Muscle Thor Costume for Kids,41,290
220,Muscle Thor Costume for Kids with Mask,309,310
221,Muscle Thor Costume for Kids with Mask and Cape,48,340
222,Ninja Turtle Costume for Kids with Mask and Shell,102,290
223,Owlette Costume PJ Masks for Kids,13,190
224,Pikachu Costume for Kids,16,180
225,Pikachu Onesie Overall for Baby (Ages 6-24 months),12,180
226,"Power Rangers Costume for Kids (Colors: Red, Blue, Yellow)",16,180
227,"Princess Anna Accessories (Crown, Wand, and Hair)",45,240
228,"Princess Elsa Accessories (Crown, Wand, and Hair)",21,60
229,Princess Elsa Costume for Kids,11,60
230,Princess Jacket for Girls Ages 2-8 (jacket can turn into a bag),11,440
231,Red Cars Costume for Kids (Satin),82,190
232,Santa Girl Costume for Kids,14,190
233,Snake Animal Costume for Kids,14,180
234,Snow White Costume Dress for Girls (Ages 2-7),13,195
235,Sofia Crown for Kids Pink or Purple,64,25
236,Spider-Girl Costume for Kids (Satin),22,180
237,Spider-man Costume for Kids (Cotton),22,240
238,Spider-man Costume for Kids (Satin),93,180
239,Spider-man Swimsuit for Kids,11,210
240,Spongebob Backpack for Kids,23,225
241,Squid Game Guard Costume for Kids with Mask,57,225
242,Squid Game Guard Costume for Kids with Mask and Toy,143,310
243,Squid Game Masks for Adult,19,40
244,Squid Game Masks for Age 10+,13,40
245,Squid Game Masks for Kids,83,40
246,Squid Game Robot Girl Dress for Kids,13,210
247,Super Girl Costume for Kids (Satin),15,180
248,Supergirl Costume for Kids with Mask and Cape (Ages 3 to 7),14,225
249,Supergirl Costume for Kids with Mask and Cape (Cotton),11,245
250,"Superhero Masks - Thor, Ironman, Bumblebee",280,25
251,Superman Brief for Boy (6-in-1 or per piece),15,90
252,Superman Costume for Kids (Cotton),18,235
253,Superman Costume for Kids (Satin),85,190
254,Superman Jacket for Boys Ages 2-9 (jacket can turn into a bag),12,120
255,Superman Onesie Overall for Babies (Ages 6-24 months),14,190
256,Thor Costume for Kids,12,275
257,Thor Costume for Kids with Mask,352,240
258,Thor Costume for Kids with Mask and Cape,163,190
259,Thor Toy Hammer for Kids,831,60
260,Tiger Onesie Overall for Baby (Ages 6-24 months),11,180
261,Toy Gun Rifle for Kids with Lights and Sounds,124,90
262,Transformers Bumblebee Costume for Kids with mask,93,190
263,Wonder Woman Costume for Kids with Mask and Cape,23,225
264,Wonder Woman Costume for Kids with Wrist and Head Band,32,180
265,[ Adult ] Batman Costume with Cape,11,340
266,[ Adult ] Superman Costume with Cape,23,340
267,Animal Costume Bee for Kids,15,180
268,Animal Costume Dragon for Kids,16,190
269,Animal Costume Elephant for Kids,11,190
270,Animal Costume Ladybug for Kids,14,190
271,Animal Costume Monkey for Kids,11,190
272,Animal Costume Mouse for Kids,12,190
273,Animal Costume Ox for Kids,11,190
274,Animal Costume Panda for Kids,11,180
275,Animal Costume Zebra for Kids,16,180
276,Barnie Onesie Overall for Babies (Ages 6-24 months),11,190
277,Batman Costume for Kids (Satin),40,225
278,Batman Onesie Overall for Baby with Cape (Ages 6-24 months),11,190
279,Batman Swimsuit for Kids,11,180
280,Ben 10 Pajamas for Boys (Ages 4 to 10),11,210
281,Bumblebee Swimsuit Costume for Kids Yellow,15,160
282,Camoflage Set for Boy or Girl,16,210
283,Captain America Costume for Kids (Satin),26,235
284,Captain America Onesie Overall for Baby (Ages 6-24 months),17,190
285,Captain America Shield Toy for Kids PVC Plastic,60,75
286,Cars Brief for Boy (3-in-1 or per peice),12,60
287,Catboy Costume Set PJ Masks,22,180
288,Chinese Dress for Kids (Cheongsam),17,190
289,Darna Costume for Kids,138,195
290,Dog Costume for Kids Yellow,12,190
291,Fruits and Veggie Costume for Kids,13,225
292,Gekko Costume Set PJ Masks,17,190
293,Hulk Costume for Kids with Mask (Satin),12,190
294,Iron Man Costume for Kids with Mask (Satin),90,190
295,Minnie Mouse Red Polka Dots Dress Costume for Kids,74,190
296,Minnie Mouse Tutu Dress,11,190
297,Muscle Batman Costume for Kids,29,280
298,Muscle Captain America Costume for Kids,30,280
299,Muscle Hulk Costume for Kids with Mask,26,280
300,Muscle Iron Man Costume for Kids with Mask,125,290
301,Muscle Spider-man Costume for Kids,18,280
302,Muscle Superman Costume for Kids,112,280
303,Muscle Thor Costume for Kids,206,290
304,Ninja Turtle Costume for Kids with Mask and Shell,190,190
305,Owlette Costume PJ Masks for Kids,11,180
306,Pikachu Costume for Kids,12,190
307,"Princess Anna Accessories (Crown, Wand, and Hair)",54,60
308,"Princess Elsa Accessories (Crown, Wand, and Hair)",18,60
309,Princess Jacket for Girls Ages 2-8 (jacket can turn into a bag),11,120
310,Red Cars Costume for Kids (Satin),36,180
311,Santa Girl Costume for Kids,19,190
312,Snake Animal Costume for Kids,17,190
313,Sofia Crown for Kids Pink or Purple,25,25
314,Spider-man Costume for Kids (Cotton),11,235
315,Spider-man Costume for Kids (Satin),56,180
316,Spongebob Backpack for Kids,31,225
317,Supergirl Costume for Kids with Mask and Cape (Cotton),13,245
318,"Superhero Masks - Thor, Ironman, Bumblebee",123,25
319,Superman Costume for Kids (Cotton),12,235
320,Superman Costume for Kids (Satin),70,190
321,Superman Jacket for Boys Ages 2-9 (jacket can turn into a bag),12,120
322,Superman Onesie Overall for Babies (Ages 6-24 months),11,190
323,Thor Costume for Kids,400,275
324,Thor Toy Hammer for Kids,380,60
325,Tiger Onesie Overall for Baby (Ages 6-24 months),11,180
326,Toy Gun Rifle for Kids with Lights and Sounds,31,90
327,Transformers Bumblebee Costume for Kids with mask,37,190
328,Wonder Woman Costume for Kids with Mask and Cape,11,225
329,Wonder Woman Costume for Kids with Wrist and Head Band,11,180
330,Sofia Crown for Kids Pink or Purple,50,25
332,"Superhero Masks - Thor, Ironman, Bumblebee",50,25
333,Thor Costume for Kids,20,150
